[
  {
    "schema_version": "1.0.0",
    "timestamp_utc": "2026-03-01T08:00:00.0000000Z",
    "host": "WKS-CORP-07",
    "host_id": "GUID-HOST-7",
    "collector_kind": "velociraptor",
    "source": "eventlog",
    "artifact": "Windows.EventLogs.Evtx",
    "timestamp_desc": "EventTime",
    "user": "DOMAIN\\alice",
    "message": "An account was successfully logged on",
    "target": "Security.evtx",
    "row_hash": "c928970b954d0b210ef543033c558e97a60d14ffe4143519b27ecde6d79ef18e"
  },
  {
    "schema_version": "1.0.0",
    "timestamp_utc": "2026-03-01T08:49:49.0000000Z",
    "host": "WKS-CORP-07",
    "host_id": "GUID-HOST-7",
    "collector_kind": "velociraptor",
    "source": "filesystem",
    "artifact": "Generic.Collectors.File",
    "timestamp_desc": "Modified",
    "user": "DOMAIN\\alice",
    "message": "File written",
    "target": "C:\\Users\\alice\\Documents\\quarterly-report.docx",
    "file": {
      "path": "C:\\Users\\alice\\Documents\\quarterly-report.docx",
      "name": "quarterly-report.docx"
    },
    "row_hash": "54cd1b838277b827f9f7f072206d45ad89bb8a0fadb53197785422ba607ed47b"
  },
  {
    "schema_version": "1.0.0",
    "timestamp_utc": "2026-03-01T09:39:39.0000000Z",
    "host": "WKS-CORP-07",
    "host_id": "GUID-HOST-7",
    "collector_kind": "velociraptor",
    "source": "process",
    "artifact": "Windows.System.Pslist",
    "timestamp_desc": "EventTime",
    "user": "SYSTEM",
    "message": "svchost.exe running",
    "target": "C:\\Windows\\System32\\svchost.exe",
    "process": {
      "name": "svchost.exe",
      "image_path": "C:\\Windows\\System32\\svchost.exe"
    },
    "row_hash": "d3f347a37d341f3ac9f6d0b71638455d42b5947b35832746f4d032c750fd1f2c"
  },
  {
    "schema_version": "1.0.0",
    "timestamp_utc": "2026-03-01T10:29:28.0000000Z",
    "host": "WKS-CORP-07",
    "host_id": "GUID-HOST-7",
    "collector_kind": "velociraptor",
    "source": "network",
    "artifact": "Windows.Network.Netstat",
    "timestamp_desc": "EventTime",
    "user": "DOMAIN\\alice",
    "message": "Outbound connection to update service",
    "target": "23.45.67.8:443",
    "network": {
      "dst_ip": "23.45.67.8",
      "domain": "updates.contoso-cdn.example",
      "dst_port": 443,
      "direction": "outbound"
    },
    "row_hash": "607552b1726ebfb043abff9cb4e918270ca60bfcdbdb4f1d380bbb42c178f02d"
  },
  {
    "schema_version": "1.0.0",
    "timestamp_utc": "2026-03-01T11:19:18.0000000Z",
    "host": "WKS-CORP-07",
    "host_id": "GUID-HOST-7",
    "collector_kind": "velociraptor",
    "source": "registry",
    "artifact": "Windows.Registry.AppCompatCache",
    "timestamp_desc": "LastWriteTime",
    "user": "SYSTEM",
    "message": "AppCompatCache entry updated",
    "target": "HKLM\\SYSTEM\\CurrentControlSet\\Control\\Session Manager\\AppCompatCache",
    "registry": {
      "key": "HKLM\\SYSTEM\\CurrentControlSet\\Control\\Session Manager\\AppCompatCache"
    },
    "row_hash": "b62de6c3aea35eb18d417812837dc923de2a7f81abdac8737b0b8cf57bdf4ce6"
  },
  {
    "schema_version": "1.0.0",
    "timestamp_utc": "2026-03-01T12:09:08.0000000Z",
    "host": "WKS-CORP-07",
    "host_id": "GUID-HOST-7",
    "collector_kind": "velociraptor",
    "source": "execution",
    "artifact": "Windows.Forensics.Prefetch",
    "timestamp_desc": "LastExecuted",
    "user": "DOMAIN\\alice",
    "message": "OUTLOOK.EXE executed",
    "target": "C:\\Program Files\\Microsoft Office\\root\\Office16\\OUTLOOK.EXE",
    "process": {
      "name": "OUTLOOK.EXE",
      "image_path": "C:\\Program Files\\Microsoft Office\\root\\Office16\\OUTLOOK.EXE"
    },
    "row_hash": "b34f3048e8bfc344e178c918cffa60925eb02a5f78cc188dd3982a633fe680b3"
  },
  {
    "schema_version": "1.0.0",
    "timestamp_utc": "2026-03-01T12:58:57.0000000Z",
    "host": "WKS-CORP-07",
    "host_id": "GUID-HOST-7",
    "collector_kind": "velociraptor",
    "source": "eventlog",
    "artifact": "Windows.EventLogs.Evtx",
    "timestamp_desc": "EventTime",
    "user": "DOMAIN\\alice",
    "message": "An account was successfully logged on",
    "target": "Security.evtx",
    "row_hash": "8a56c6fd20f633af8f2139ee48ee8c1243c01bf000d3e630b3177b34a19d6357"
  },
  {
    "schema_version": "1.0.0",
    "timestamp_utc": "2026-03-01T13:48:47.0000000Z",
    "host": "WKS-CORP-07",
    "host_id": "GUID-HOST-7",
    "collector_kind": "velociraptor",
    "source": "filesystem",
    "artifact": "Generic.Collectors.File",
    "timestamp_desc": "Modified",
    "user": "DOMAIN\\alice",
    "message": "File written",
    "target": "C:\\Users\\alice\\Documents\\quarterly-report.docx",
    "file": {
      "path": "C:\\Users\\alice\\Documents\\quarterly-report.docx",
      "name": "quarterly-report.docx"
    },
    "row_hash": "6954cca40b284f86503952b8971887c87ea29398b0ae3464b8c2a842c21051ea"
  },
  {
    "schema_version": "1.0.0",
    "timestamp_utc": "2026-03-01T14:38:36.0000000Z",
    "host": "WKS-CORP-07",
    "host_id": "GUID-HOST-7",
    "collector_kind": "velociraptor",
    "source": "process",
    "artifact": "Windows.System.Pslist",
    "timestamp_desc": "EventTime",
    "user": "SYSTEM",
    "message": "svchost.exe running",
    "target": "C:\\Windows\\System32\\svchost.exe",
    "process": {
      "name": "svchost.exe",
      "image_path": "C:\\Windows\\System32\\svchost.exe"
    },
    "row_hash": "0b7f4fc690013151e93a8c919bd6cd4ad50b7c6ff8d31a144570257dcf44a9ba"
  },
  {
    "schema_version": "1.0.0",
    "timestamp_utc": "2026-03-01T15:28:26.0000000Z",
    "host": "WKS-CORP-07",
    "host_id": "GUID-HOST-7",
    "collector_kind": "velociraptor",
    "source": "network",
    "artifact": "Windows.Network.Netstat",
    "timestamp_desc": "EventTime",
    "user": "DOMAIN\\alice",
    "message": "Outbound connection to update service",
    "target": "23.45.67.8:443",
    "network": {
      "dst_ip": "23.45.67.8",
      "domain": "updates.contoso-cdn.example",
      "dst_port": 443,
      "direction": "outbound"
    },
    "row_hash": "f824c57b732035379d676a4b43d4a4aaf18fb928fa294876cb2b7aca0e949ed7"
  },
  {
    "schema_version": "1.0.0",
    "timestamp_utc": "2026-03-01T16:18:16.0000000Z",
    "host": "WKS-CORP-07",
    "host_id": "GUID-HOST-7",
    "collector_kind": "velociraptor",
    "source": "registry",
    "artifact": "Windows.Registry.AppCompatCache",
    "timestamp_desc": "LastWriteTime",
    "user": "SYSTEM",
    "message": "AppCompatCache entry updated",
    "target": "HKLM\\SYSTEM\\CurrentControlSet\\Control\\Session Manager\\AppCompatCache",
    "registry": {
      "key": "HKLM\\SYSTEM\\CurrentControlSet\\Control\\Session Manager\\AppCompatCache"
    },
    "row_hash": "d8a0582f2bd764fd2f42024031c4fed238b671e45b8f18f3ce1ac430315f8027"
  },
  {
    "schema_version": "1.0.0",
    "timestamp_utc": "2026-03-01T17:08:05.0000000Z",
    "host": "WKS-CORP-07",
    "host_id": "GUID-HOST-7",
    "collector_kind": "velociraptor",
    "source": "execution",
    "artifact": "Windows.Forensics.Prefetch",
    "timestamp_desc": "LastExecuted",
    "user": "DOMAIN\\alice",
    "message": "OUTLOOK.EXE executed",
    "target": "C:\\Program Files\\Microsoft Office\\root\\Office16\\OUTLOOK.EXE",
    "process": {
      "name": "OUTLOOK.EXE",
      "image_path": "C:\\Program Files\\Microsoft Office\\root\\Office16\\OUTLOOK.EXE"
    },
    "row_hash": "ce3af222d7bc07c3128d196f86f514d9b0721d89e9377375a684c51c101c5411"
  },
  {
    "schema_version": "1.0.0",
    "timestamp_utc": "2026-03-01T17:57:55.0000000Z",
    "host": "WKS-CORP-07",
    "host_id": "GUID-HOST-7",
    "collector_kind": "velociraptor",
    "source": "eventlog",
    "artifact": "Windows.EventLogs.Evtx",
    "timestamp_desc": "EventTime",
    "user": "DOMAIN\\alice",
    "message": "An account was successfully logged on",
    "target": "Security.evtx",
    "row_hash": "0af86f30715db46acce52aa44e09536237578671c56dcdbd8fce5a4cd14c39ce"
  },
  {
    "schema_version": "1.0.0",
    "timestamp_utc": "2026-03-01T18:47:45.0000000Z",
    "host": "WKS-CORP-07",
    "host_id": "GUID-HOST-7",
    "collector_kind": "velociraptor",
    "source": "filesystem",
    "artifact": "Generic.Collectors.File",
    "timestamp_desc": "Modified",
    "user": "DOMAIN\\alice",
    "message": "File written",
    "target": "C:\\Users\\alice\\Documents\\quarterly-report.docx",
    "file": {
      "path": "C:\\Users\\alice\\Documents\\quarterly-report.docx",
      "name": "quarterly-report.docx"
    },
    "row_hash": "91ea9f19d3352ec3b3cc7a0519badfc40f0e3f2afd24c369d623e84aed757430"
  },
  {
    "schema_version": "1.0.0",
    "timestamp_utc": "2026-03-01T19:37:34.0000000Z",
    "host": "WKS-CORP-07",
    "host_id": "GUID-HOST-7",
    "collector_kind": "velociraptor",
    "source": "process",
    "artifact": "Windows.System.Pslist",
    "timestamp_desc": "EventTime",
    "user": "SYSTEM",
    "message": "svchost.exe running",
    "target": "C:\\Windows\\System32\\svchost.exe",
    "process": {
      "name": "svchost.exe",
      "image_path": "C:\\Windows\\System32\\svchost.exe"
    },
    "row_hash": "3552b6030f113537a1561919c960a74b3487e64ea6bf14fa84853df8d3755c15"
  },
  {
    "schema_version": "1.0.0",
    "timestamp_utc": "2026-03-01T20:27:24.0000000Z",
    "host": "WKS-CORP-07",
    "host_id": "GUID-HOST-7",
    "collector_kind": "velociraptor",
    "source": "network",
    "artifact": "Windows.Network.Netstat",
    "timestamp_desc": "EventTime",
    "user": "DOMAIN\\alice",
    "message": "Outbound connection to update service",
    "target": "23.45.67.8:443",
    "network": {
      "dst_ip": "23.45.67.8",
      "domain": "updates.contoso-cdn.example",
      "dst_port": 443,
      "direction": "outbound"
    },
    "row_hash": "0e1f1a3866dca25f2c9f05ad748784cf300172dd399bbd3cd087c41c026679c8"
  },
  {
    "schema_version": "1.0.0",
    "timestamp_utc": "2026-03-01T21:17:13.0000000Z",
    "host": "WKS-CORP-07",
    "host_id": "GUID-HOST-7",
    "collector_kind": "velociraptor",
    "source": "registry",